{
	"$schema": "./voices-schema.json",

	"providers": {
		"edgetts": {
			"enabled": true,
			"defaultVoice": "en-US-AvaNeural",
			"rate": "+0%",
			"description": "Microsoft Edge TTS - free, high-quality neural voices"
		},
		"kokoro": {
			"enabled": false,
			"endpoint": "http://127.0.0.1:8880/v1",
			"defaultVoice": "af_sky",
			"description": "Local TTS - free, offline, no API key needed (disabled - service not running)"
		},
		"elevenlabs": {
			"enabled": false,
			"apiKey": "${ELEVENLABS_API_KEY}",
			"defaultVoiceId": "s3TPKV1kjDlVtZbl4Ksh",
			"description": "Premium cloud TTS - requires API key from elevenlabs.io"
		},
		"say": {
			"enabled": true,
			"voice": "Daniel (Enhanced)",
			"description": "macOS built-in - always available fallback"
		}
	},
	"defaultProvider": "edgetts",
	"fallbackOrder": ["edgetts", "elevenlabs", "kokoro", "say"],

	"default_rate": 175,
	"default_volume": 0.8,

	"identity": {
		"description": "Main AI assistant voice (Atlas)",
		"elevenlabs": {
			"voice_id": "Ioq2c1GJee5RyqeoBIH3",
			"stability": 0.35,
			"similarity_boost": 0.8,
			"style": 0.9,
			"use_speaker_boost": true
		},
		"kokoro": {
			"voice": "af_heart",
			"speed": 1.1
		}
	},

	"agents": {
		"kai": {
			"description": "UK Male - Expressive eager buddy: genuinely excited to help, animated celebrations, warm and enthusiastic partner",
			"catchphrase": "Kai here, let's do this!",
			"elevenlabs": {
				"voice_id": "s3TPKV1kjDlVtZbl4Ksh",
				"voice_name": "Jamie (Premium)",
				"stability": 0.5,
				"similarity_boost": 0.75
			},
			"kokoro": {
				"voice": "am_fenrir",
				"speed": 1.1
			}
		},
		"perplexity-researcher": {
			"description": "US Female - Analytical, authoritative, confident",
			"catchphrase": "Perplexity Researcher online. Let me investigate.",
			"elevenlabs": {
				"voice_id": "AXdMgz6evoL7OPd7eU12",
				"voice_name": "Ava (Premium)",
				"stability": 0.65,
				"similarity_boost": 0.9
			},
			"kokoro": {
				"voice": "af_kore",
				"speed": 1.0
			}
		},
		"claude-researcher": {
			"description": "US Female - Strategic, sophisticated, authoritative",
			"catchphrase": "Claude Researcher ready.",
			"elevenlabs": {
				"voice_id": "AXdMgz6evoL7OPd7eU12",
				"voice_name": "Ava (Premium)",
				"stability": 0.65,
				"similarity_boost": 0.9
			},
			"kokoro": {
				"voice": "af_sky",
				"speed": 1.0
			}
		},
		"gemini-researcher": {
			"description": "Multi-perspective, thorough, analytical",
			"catchphrase": "Gemini Researcher online.",
			"elevenlabs": {
				"voice_id": "2zRM7PkgwBPiau2jvVXc",
				"voice_name": "Multi-perspective",
				"stability": 0.65,
				"similarity_boost": 0.85
			},
			"kokoro": {
				"voice": "af_nova",
				"speed": 1.0
			}
		},
		"engineer": {
			"description": "Strategic, senior leadership, measured - battle-scarred engineering leader",
			"catchphrase": "Engineer ready!",
			"elevenlabs": {
				"voice_id": "Fahco4VZzobUeiPqni1S",
				"voice_name": "Marcus (Premium)",
				"stability": 0.7,
				"similarity_boost": 0.85
			},
			"kokoro": {
				"voice": "am_michael",
				"speed": 0.95
			}
		},
		"architect": {
			"description": "UK Female - Strategic, sophisticated, wise",
			"catchphrase": "Architect online.",
			"elevenlabs": {
				"voice_id": "NNl6r8mD7vthiJatiJt1",
				"voice_name": "Serena (Premium)",
				"stability": 0.7,
				"similarity_boost": 0.85
			},
			"kokoro": {
				"voice": "bf_alice",
				"speed": 0.95
			}
		},
		"designer": {
			"description": "Indian Female - Sophisticated critic: snobby perfectionist, judgmental eye, dismissive of mediocrity",
			"catchphrase": "Designer here.",
			"elevenlabs": {
				"voice_id": "h8eW5xfRUGVJrZhAFxqK",
				"voice_name": "Isha (Premium)",
				"stability": 0.62,
				"similarity_boost": 0.85
			},
			"kokoro": {
				"voice": "af_nicole",
				"speed": 1.0
			}
		},
		"artist": {
			"description": "Indian Female - Dreamy visionary: eccentric, flighty tangents, distracted by beauty, unconventional ideas",
			"catchphrase": "Artist here.",
			"elevenlabs": {
				"voice_id": "h8eW5xfRUGVJrZhAFxqK",
				"voice_name": "Isha (Premium)",
				"stability": 0.38,
				"similarity_boost": 0.68
			},
			"kokoro": {
				"voice": "af_sarah",
				"speed": 0.9
			}
		},
		"pentester": {
			"description": "UK Male - Mischievous hacker: overly excited finding vulns, playful chaos, curious puzzle-solver",
			"catchphrase": "Pentester active.",
			"elevenlabs": {
				"voice_id": "UZvBfqEdvCFLqsBOo9Zr",
				"voice_name": "Oliver (Enhanced)",
				"stability": 0.32,
				"similarity_boost": 0.88
			},
			"kokoro": {
				"voice": "bm_george",
				"speed": 1.15
			}
		},
		"writer": {
			"description": "UK Female - Articulate, warm, engaging",
			"catchphrase": "Writer at your service.",
			"elevenlabs": {
				"voice_id": "goT3UYdM9bhm0n2lmKQx",
				"voice_name": "Serena (Premium)",
				"stability": 0.6,
				"similarity_boost": 0.8
			},
			"kokoro": {
				"voice": "bf_emma",
				"speed": 0.95
			}
		},
		"intern": {
			"description": "Brilliant overachiever: eager to prove themselves, insatiably curious, enthusiastic about everything",
			"catchphrase": "Intern reporting for duty!",
			"elevenlabs": {
				"voice_id": "lcMyyd2HUfFzxdCaC4Ta",
				"voice_name": "High-energy genius",
				"stability": 0.42,
				"similarity_boost": 0.72
			},
			"kokoro": {
				"voice": "bf_isabella",
				"speed": 1.2
			}
		},
		"codex-researcher": {
			"description": "Eccentric technical archaeologist - treasure hunting researcher",
			"catchphrase": "Codex Researcher active.",
			"kokoro": {
				"voice": "am_adam",
				"speed": 1.05
			}
		},
		"grok-researcher": {
			"description": "Contrarian fact-based researcher - unbiased analysis",
			"catchphrase": "Grok Researcher active.",
			"kokoro": {
				"voice": "am_michael",
				"speed": 1.0
			}
		},
		"algorithm": {
			"description": "The PAI Algorithm - core systematic intelligence, methodical and precise",
			"catchphrase": "Algorithm initiating.",
			"elevenlabs": {
				"voice_id": "Ioq2c1GJee5RyqeoBIH3",
				"voice_name": "Atlas (Identity)",
				"stability": 0.8,
				"similarity_boost": 0.9
			},
			"kokoro": {
				"voice": "af_heart",
				"speed": 1.0
			}
		},
		"qa-tester": {
			"description": "Methodical, precise - quality assurance specialist focused on verification",
			"catchphrase": "QA Tester active. Running verification.",
			"kokoro": {
				"voice": "am_adam",
				"speed": 0.9
			}
		}
	}
}
